{
  "dataset_class": "PUBLIC_KB",
  "synthetic": false,
  "product_terms_version_id": "ptv:kb-seller-loan:sha256:647d5d3588b9d16dce6e4bd91044018a5ab0287c174ac7a945b85bc14abd031d",
  "product_key": "kb-seller-loan",
  "terms_hash": "sha256:647d5d3588b9d16dce6e4bd91044018a5ab0287c174ac7a945b85bc14abd031d",
  "effective_from": null,
  "effective_to": null,
  "facts": [
    {
      "fact_id": "fact:kb-seller-loan:applicant_eligibility_text",
      "fact_key": "applicant_eligibility_text",
      "subject_type": "PRODUCT",
      "value_type": "TEXT",
      "value": "- 마켓(또는 PG) : 아래 각 1의 요건을 모두 충족하는 사업자 ㅇ 오프라인 또는 온라인 상에 거래공간, 서비스 등을 제공하는 플랫폼 사업자(오픈마켓, 소셜커머스, 종합몰 등) ㅇ KB와 전문 송수신 프로세스(API, 전용선 등) 구축하여 상품운영에 필요한 셀러별 매출액(배송완료), 반품률 등 정보제공이 가능한 사업자 - 셀러 : 아래 각 1의 기준을 모두 충족하는 고객 ㅇ 당행과 대출한도 제휴되어 있는 마켓(또는 PG)에서 재화 등을 판매하고 있는 셀러 ※ 제휴마켓 : 쿠팡, 지마켓(옥션/G마켓), 무신사, 더블유컨셉코리아, SSG닷컴, KG이니시스 (2026.04.07 기준) ㅇ 당행 심사기준(마켓 또는 PG별 운영기준 별도 운영)을 충족하는 셀러",
      "unit": "TEXT"
    },
    {
      "fact_id": "fact:kb-seller-loan:max_limit_corporate_krw",
      "fact_key": "max_limit_corporate_krw",
      "subject_type": "CORPORATION",
      "value_type": "INTEGER",
      "value": 2000000000,
      "unit": "KRW"
    },
    {
      "fact_id": "fact:kb-seller-loan:max_limit_individual_krw",
      "fact_key": "max_limit_individual_krw",
      "subject_type": "SOLE_PROPRIETOR",
      "value_type": "INTEGER",
      "value": 500000000,
      "unit": "KRW"
    },
    {
      "fact_id": "fact:kb-seller-loan:product_name",
      "fact_key": "product_name",
      "subject_type": "PRODUCT",
      "value_type": "TEXT",
      "value": "KB셀러론",
      "unit": "TEXT"
    },
    {
      "fact_id": "fact:kb-seller-loan:repayment_method_text",
      "fact_key": "repayment_method_text",
      "subject_type": "PRODUCT",
      "value_type": "TEXT",
      "value": "- 일시상환방식 * 이자선취방식 : 원금은 기일에 회수하고, 이자는 일괄선취",
      "unit": "TEXT"
    },
    {
      "fact_id": "fact:kb-seller-loan:sale_status",
      "fact_key": "sale_status",
      "subject_type": "PRODUCT",
      "value_type": "STATUS",
      "value": "SELLING",
      "unit": "STATUS"
    }
  ]
}
